{
  "schema_version": "1.0.0",
  "scope": {
    "task": "对《广东移动迭代需求说明202603.pdf》进行 issue-report 扫描（需求缺失/冲突/歧义/覆盖缺口）",
    "objects": [
      "流程资产：端到端流程（列表/新建/详情/子流程弹窗）",
      "流程中心/流程分析：菜单更名与顺序调整",
      "流程分析：新手向导（首页步骤引导）",
      "流程分析：一致性分析（设置页、BPMN 获取、同步最新流程、数据匹配规则）",
      "流程分析：工作区绑定流程资产（多级/单级模型绑定端到端/职能流程）",
      "流程资产 → 流程分析：进入分析工作区入口与权限",
      "权限管理：权限类型调整与默认权限",
      "流程资产调整内容（已完成上线）"
    ]
  },
  "summary": {
    "high": 4,
    "medium": 7,
    "low": 2
  },
  "issues": [
    {
      "type": "ambiguous",
      "severity": "high",
      "title": "权限模型关键规则不够可执行（默认查看权限、独立/继承切换与可配置范围）",
      "description": "需求描述提出：新增对象去掉“权限类型”，一级对象默认独立权限且前端不展示；其它子级对象默认继承权限且允许切换为独立权限；同时又要求“默认所有用户拥有所有对象的查看权限，不需要额外配置”，并且前端是否展示“所有用户”的查看权限均可。这里缺少可落地的权限判定矩阵（对象×操作×角色/用户组×继承规则），也缺少从旧模型迁移到新模型时的兼容策略（已有对象的权限如何处理）。",
      "why_it_matters": "权限改动属于高风险变更，规则不清会导致越权或误封、以及大量返工（前后端/测试均无法制定验收用例）。",
      "evidence": [
        "Page 11: “新增对象时，去掉【权限类型】选项，改为在列表操作栏统一配置”",
        "Page 11: “一级对象…默认独立权限…其它子级对象默认继承权限，允许切换为独立权限”",
        "Page 11: “默认所有用户拥有所有对象的查看权限，不需要额外配置…不允许编辑和删除”",
        "Page 12: “以上调整涉及所有支持权限管理的对象，包括…流程资产/流程分析/数据池…”"
      ],
      "suggestion": "补齐“权限判定矩阵”与“继承/独立的定义”，明确：1) 角色来源（用户/用户组/所有用户） 2) 查看/编辑/配置管理的边界 3) 切换为独立权限时是否复制继承快照 4) 删除/创建等操作如何映射到新权限项 5) 历史数据迁移与回滚策略。",
      "impacted_objects": [
        "权限设置 UI",
        "后端鉴权/权限存储",
        "对象列表与操作栏",
        "测试用例与回归范围"
      ]
    },
    {
      "type": "missing",
      "severity": "high",
      "title": "一致性分析：BPMN 获取失败/缺失时的处理仅给出单一弹窗，缺少完整异常与重试策略",
      "description": "单级模型绑定职能流程时，进入一致性分析设置页会自动获取“最新已发布版本的 BPMN 图”，未获取到则弹窗“未获取到BPMN！”。但未说明：失败原因区分（无发布版本/无权限/网络/接口错误）、是否可重试、是否允许手动选择版本、以及后续分析按钮/配置项的可用性与状态展示。",
      "why_it_matters": "这是核心分析链路的前置依赖；异常处理不清会导致用户卡死、测试无法覆盖、线上问题难排查。",
      "evidence": [
        "Page 7: “进入设置页…自动获取其最新已发布版本的BPMN图。若未获取到，弹窗报错：未获取到BPMN！”"
      ],
      "suggestion": "补齐失败场景：无发布版本/无权限/接口超时/解析失败；定义 UI 状态（loading/empty/error）、重试入口、以及是否允许选择历史版本或跳过绑定。",
      "impacted_objects": [
        "一致性分析设置页",
        "流程资产版本服务/接口",
        "错误码与日志"
      ]
    },
    {
      "type": "ambiguous",
      "severity": "high",
      "title": "多级模型一致性分析的数据匹配规则缺少冲突处理与输出定义",
      "description": "多级模型绑定端到端/职能流程后，在设置页自动获取职能流程列表及 BPMN 图，并给出匹配规则：层级一致、名称一致、数据模型活动必须为包含子流程的活动。但未说明：名称不一致如何处理（忽略/提示/可手工映射）、同名多项如何消歧、层级不一致的判定与容错（空层级、缺失层级）、以及一致性分析产出的差异结果如何展示与导出。",
      "why_it_matters": "匹配规则决定分析结果准确性；缺少冲突/容错/结果输出定义会导致产品、研发、测试对齐失败。",
      "evidence": [
        "Page 8: “数据匹配规则：层级一致…名称一致…数据模型中的活动必须为包含子流程的活动”",
        "Page 8: “进入设置页…自动获取其职能流程列表及…BPMN图”"
      ],
      "suggestion": "补齐匹配算法与异常策略：1) 匹配优先级（ID/名称/路径） 2) 处理重名与同层多项 3) 匹配失败提示与手工映射入口 4) 结果展示字段（缺失环节/多余环节/路径差异）与导出格式。",
      "impacted_objects": [
        "一致性分析核心算法",
        "设置页配置项结构",
        "结果页/报告"
      ]
    },
    {
      "type": "missing",
      "severity": "high",
      "title": "端到端流程详情页“进入分析工作区”按钮的权限判断规则缺失",
      "description": "端到端流程详情页若有关联工作区则显示“进入分析工作区”，且多个工作区需悬浮显示入口；并明确“需要考虑用户权限”。但未说明：权限来源（工作区权限/端到端流程权限/两者并集）、无权限时按钮是否隐藏或置灰、以及提示文案与审计要求。",
      "why_it_matters": "入口与权限绑定不清容易出现越权入口或误隐藏，影响核心使用路径与测试验收。",
      "evidence": [
        "Page 9: “若有关联的工作区，显示【进入分析工作区】按钮…判断是否显示按钮…需要考虑用户权限。”"
      ],
      "suggestion": "补齐权限规则与 UI 行为：按钮显示条件、可见工作区列表过滤、无权限提示文案、以及是否记录访问审计（如有要求）。",
      "impacted_objects": [
        "端到端流程详情页",
        "工作区权限模型",
        "路由与导航"
      ]
    },
    {
      "type": "ambiguous",
      "severity": "medium",
      "title": "端到端流程创建：可跨越多个 L2-L4 选择的业务含义与约束不清",
      "description": "需求提出从流程资产目录新建挖掘流程时，可选择流程归属层级，并“可跨越多个 L2-L4 层级选择”。但未明确：允许选择的最小/最大层级、是否允许混选 L2/L3/L4、同一路径选择多节点的关系如何解释、以及与后续“最多支持两级”展示规则之间的对应关系。",
      "why_it_matters": "层级选择规则会影响数据归属、展示结构、以及后续一致性分析的匹配；不清会导致实现与验收分歧。",
      "evidence": [
        "Page 1: “可跨越多个L2-L4层级选择”",
        "Page 3: “可拖动调整…最多支持两级…取消一级其子流程自动升级为一级”"
      ],
      "suggestion": "明确层级选择与保存模型：允许的节点类型、混选规则、保存后的层级归一化规则、以及与展示“两级”的一致性。",
      "impacted_objects": [
        "端到端流程新建表单",
        "选择流程抽屉",
        "数据结构（层级/排序）"
      ]
    },
    {
      "type": "missing",
      "severity": "medium",
      "title": "“常驻看板页面”对比维度与刷新机制缺失",
      "description": "提出新增常驻看板页面，用于“数据还原流程信息”与“流程资产流程信息”比对（执行路径、活动环节等）。但未定义：入口位置、看板的查询条件/时间范围、比对算法（忽略/合并规则）、差异高亮与汇总指标、以及权限与缓存/刷新策略。",
      "why_it_matters": "看板属于核心价值展示页面；缺少维度定义会导致开发无法落地、测试无法写用例、用户无法理解差异含义。",
      "evidence": [
        "Page 1: “新增一页常驻的看板页面…相比对（如流程执行路径比对，活动环节比对等）”"
      ],
      "suggestion": "补齐看板 PRD 要素：入口、筛选项、对比口径、差异展示与导出、刷新频率与权限控制。",
      "impacted_objects": [
        "端到端流程看板页",
        "数据还原口径",
        "流程资产数据"
      ]
    },
    {
      "type": "ambiguous",
      "severity": "medium",
      "title": "端到端流程详情页的布局规则过于“描述性”，缺少可验收的 UI 规格",
      "description": "详情页要求主流程箭头表达先后顺序、S 弯换行、旁支流程无箭头按顺序展示、一行放不下自动换行、无旁支隐藏模块等；并标注“详情页需要UI美化”。但缺少：卡片尺寸/换行断点/移动端适配、箭头与 S 弯在不同分辨率下的规则、以及 UI 美化的验收口径。",
      "why_it_matters": "布局类需求如果没有可验收规格，容易在研发/设计/测试间反复对齐，影响交付节奏。",
      "evidence": [
        "Page 4: “主流程之间用箭头…S弯换行…旁支流程…自动换行…UI美化”"
      ],
      "suggestion": "补齐 UI 规格：断点与响应式规则、示例图对应的像素/栅格约束、无数据/加载态、以及“美化”的验收清单。",
      "impacted_objects": [
        "端到端流程详情页",
        "前端布局/组件库"
      ]
    },
    {
      "type": "missing",
      "severity": "medium",
      "title": "子流程弹窗：层级深度与交互（多级子流程、关闭/返回、路径展示）缺失",
      "description": "要求卡片含子流程时显示“含子流程”标签，点击打开子流程弹窗，内容展示与主流程相同，标题为“[子流程名称]·子流程”。但未说明：子流程是否还可能包含子流程（递归深度）、多子流程如何选择、以及弹窗内是否支持继续下钻/返回。",
      "why_it_matters": "流程天然可能多级嵌套；缺少深度与交互约束会导致实现分歧与不可控复杂度。",
      "evidence": [
        "Page 4: “若流程包含子流程…点击可打开子流程弹窗”",
        "Page 4: “子流程内容展示与主流程展示相同…标题…”"
      ],
      "suggestion": "明确子流程层级与交互：最大下钻层级、同层多个子流程的呈现方式、以及弹窗内是否允许继续下钻。",
      "impacted_objects": [
        "子流程弹窗",
        "端到端流程数据结构"
      ]
    },
    {
      "type": "coverage-gap",
      "severity": "medium",
      "title": "“同步最新流程”按钮：同步范围、差异提示与回滚缺失",
      "description": "说明当端到端/L4 流程变更或 L4 发布新版本时，可点击“同步最新流程”将配置项同步至最新版。但未说明：同步哪些配置（绑定关系/映射/过滤条件）、是否提示差异与确认、同步失败怎么处理、以及是否可回滚到之前版本。",
      "why_it_matters": "同步会影响分析配置的可复现性；没有差异提示/回滚会引发结果不可追溯、测试难复现。",
      "evidence": [
        "Page 8: “可点击【同步最新流程】按钮将配置项同步至最新版。”"
      ],
      "suggestion": "定义同步协议：同步范围、版本号记录、差异提示（新增/删除/改名环节）、回滚能力或至少保留历史配置快照。",
      "impacted_objects": [
        "一致性分析配置",
        "流程版本管理"
      ]
    },
    {
      "type": "ambiguous",
      "severity": "medium",
      "title": "菜单更名与全局替换的影响范围与兼容策略未定义",
      "description": "提出“流程中心”更名“流程分析”，并要求相关页面、主页入口、模块标题、用户/用户组权限配置命名等全局替换。缺少：URL/路由是否变更、历史链接/书签兼容、权限项 key 是否变更（只改展示文案还是枚举值也变）、以及多语言/文案资源的处理。",
      "why_it_matters": "全局替换很容易引发回归（路由、权限、埋点、文案）。没有兼容策略会造成线上断链或权限错配。",
      "evidence": [
        "Page 9: “‘流程中心’更名‘流程分析’…全局替换。”",
        "Page 9: “菜单顺序调整…主页、流程资产、流程分析、数据池”"
      ],
      "suggestion": "明确替换范围与兼容：路由是否保持不变、旧入口跳转策略、权限标识（key）是否保持稳定、以及埋点/报表字段是否需要同步。",
      "impacted_objects": [
        "导航与路由",
        "权限配置项",
        "埋点/运营报表"
      ]
    },
    {
      "type": "missing",
      "severity": "low",
      "title": "新手向导“降低帮助手册视觉权重”不可验收",
      "description": "提出流程分析首页增加操作步骤向导，并“降低产品帮助手册文档的视觉权重”。但没有给出具体衡量方式（字号/位置/折叠/入口），也缺少跳转目标与埋点需求。",
      "why_it_matters": "这类需求如果不量化，容易反复沟通与返工；虽风险不高但会拖慢交付。",
      "evidence": [
        "Page 10: “增加步骤引导…降低产品帮助手册文档的视觉权重。”"
      ],
      "suggestion": "给出可验收规格：入口位置、层级、字号/颜色/占位、是否默认折叠，以及点击跳转目标与埋点。",
      "impacted_objects": [
        "流程分析首页",
        "帮助中心入口"
      ]
    },
    {
      "type": "coverage-gap",
      "severity": "low",
      "title": "“删除动态模型页签”缺少说明与迁移提示",
      "description": "仅说明“删除原职能流程【动态模型】页签”，未描述删除原因、替代入口、以及对存量用户的引导提示（是否需要公告/提示/保留只读）。",
      "why_it_matters": "删入口会影响存量用户习惯与文档；缺少引导会带来工单与用户困惑。",
      "evidence": [
        "Page 9: “删除原职能流程【动态模型】页签”"
      ],
      "suggestion": "补充：替代功能入口、变更提示文案、以及与帮助文档/培训材料的同步更新要求。",
      "impacted_objects": [
        "职能流程详情页",
        "用户指引/文档"
      ]
    }
  ],
  "pending_confirmations": [
    {
      "question": "权限：默认“所有用户查看”是否包含外部/匿名用户？“查看”具体包含哪些数据范围（列表/详情/导出/接口）？",
      "owner_hint": "产品/安全/后端",
      "suggested_options": [
        "仅登录用户默认查看，匿名不可见",
        "所有登录用户默认查看（不含导出/敏感字段）",
        "需要按用户组配置查看（不做默认）"
      ]
    },
    {
      "question": "一致性分析：当 BPMN 获取失败时，是否允许手动选择流程版本或手动上传/粘贴 BPMN？失败时页面是否可继续保存配置？",
      "owner_hint": "产品/后端/前端",
      "suggested_options": [
        "仅支持最新已发布，失败必须修复后才能继续",
        "允许选择历史已发布版本作为回退",
        "允许手工提供 BPMN（上传/粘贴）"
      ]
    },
    {
      "question": "一致性分析匹配：名称一致的比较规则是什么（全等/去空格/大小写/同义词库）？重名或多匹配如何处理？",
      "owner_hint": "产品/算法/后端",
      "suggested_options": [
        "严格全等（含空格/大小写）",
        "标准化后比较（trim/大小写/全半角）",
        "支持手工映射，默认弱匹配"
      ]
    },
    {
      "question": "“同步最新流程”是否需要保留历史配置快照（可回滚）？同步前是否弹窗展示差异并确认？",
      "owner_hint": "产品/后端/测试",
      "suggested_options": [
        "必须保留快照并支持回滚",
        "仅提示差异，不提供回滚",
        "静默同步（不推荐）"
      ]
    },
    {
      "question": "端到端流程详情页的 UI 规则：是否需要适配移动端？不同分辨率下 S 弯换行与箭头渲染规则是否有设计稿/组件约束？",
      "owner_hint": "产品/设计/前端",
      "suggested_options": [
        "仅 PC Web，按设计稿实现",
        "PC + iPad 适配，提供断点规则",
        "全端适配（需要单独设计与排期）"
      ]
    }
  ]
}

