{
  "schema_version": "1.0.0",
  "scope": {
    "task": "广东移动 issue-report regression sample",
    "objects": [
      "流程资产"
    ]
  },
  "summary": {
    "high": 0,
    "medium": 1,
    "low": 0
  },
  "issues": [
    {
      "type": "ambiguous",
      "severity": "medium",
      "title": "regressed content",
      "description": "still schema-valid but too weak",
      "why_it_matters": "used to verify semantic checks"
    }
  ],
  "pending_confirmations": []
}
